{
  "slug": "at-the-seaside",
  "title": "At the Seaside",
  "subtitle": "Water as strength, peace and release.",
  "description": "A collection inspired by lakes, seas, oceans and the feeling of breathing freely again.",
  "cover_image": "uploads/2025/01/IMG_5810.avif",
  "order": 4,
  "prev_slug": "little-pleasures",
  "next_slug": "mind-games",
  "cta": "Interested in a seaside-inspired piece?",
  "featured_on_home": false
}
