{
  "slug": "flora",
  "title": "Flora",
  "subtitle": "Flowers, femininity, fragility and preserved memory.",
  "description": "The timeless bond between girls and flowers finds eternal life on canvas.",
  "cover_image": "uploads/2025/02/5330074966210769632.avif",
  "order": 7,
  "prev_slug": "confessions-should-be-better-planned",
  "next_slug": null,
  "cta": "Looking for a floral piece?",
  "featured_on_home": true
}
