{
  "slug": "confessions-should-be-better-planned",
  "title": "Confessions should be better planned",
  "subtitle": "Raw expression, hidden truths and emotional chaos.",
  "description": "A series about words left unspoken, desires misread and emotions too intense to stay inside.",
  "cover_image": "uploads/2025/01/IMG_5550-scaled.avif",
  "order": 6,
  "prev_slug": "mind-games",
  "next_slug": "flora",
  "cta": "Interested in a confession?",
  "featured_on_home": false
}
