{
  "slug": "mind-games",
  "title": "Mind Games",
  "subtitle": "Symbols, puzzles and hidden meanings.",
  "description": "A black-and-white sketch series with sharp red accents and stories that reveal themselves only when you look closer.",
  "cover_image": "uploads/2025/01/IMG_5785.avif",
  "order": 5,
  "prev_slug": "at-the-seaside",
  "next_slug": "confessions-should-be-better-planned",
  "cta": "Explore this symbolic series.",
  "featured_on_home": false
}
