{
  "slug": "little-pleasures",
  "title": "Little Pleasures",
  "subtitle": "Everyday objects turned into quiet joy.",
  "description": "A soft pastel collection about light, reflection and the beauty we notice only when we slow down.",
  "cover_image": "uploads/2025/01/IMG_5801.avif",
  "order": 3,
  "prev_slug": "bits-and-pieces",
  "next_slug": "at-the-seaside",
  "cta": "Bring a quiet pleasure into your space.",
  "featured_on_home": true
}
