{
  "slug": "bits-and-pieces",
  "title": "Bits and Pieces",
  "subtitle": "Small details. Grand impressions. Emotional traces.",
  "description": "A collection about sensory memory, nostalgia and the quiet beauty hidden in ordinary things.",
  "cover_image": "uploads/2025/01/IMG_5841.avif",
  "order": 2,
  "prev_slug": "big-city-life",
  "next_slug": "little-pleasures",
  "cta": "Looking for a quiet emotional piece?",
  "featured_on_home": true
}
