{
  "slug": "big-city-life",
  "title": "Big City Life",
  "subtitle": "Cities as chapters of a life lived fully.",
  "description": "A tribute to the places that shaped Alena's journey — real, remembered, imagined and loved. Each image captures a fleeting moment, a memory etched into the soul.",
  "cover_image": "uploads/2025/01/tramvai-alena.avif",
  "order": 1,
  "prev_slug": null,
  "next_slug": "bits-and-pieces",
  "cta": "Interested in a city-inspired work?",
  "featured_on_home": true
}
